{
  "$schema": "https://json-schema.org/draft/2020-12/schema",
  "$id": "https://github.com/alien0077/tw-junior-cap-learning/schemas/question.schema.json",
  "title": "題目資料",
  "type": "object",
  "additionalProperties": false,
  "required": [
    "id",
    "subject",
    "type",
    "prompt",
    "knowledgeIds",
    "answer",
    "solutionStrategy",
    "solutionSteps",
    "provenance",
    "reviewStatus",
    "lessonId"
  ],
  "properties": {
    "id": {
      "type": "string",
      "pattern": "^question-(chinese|english|math|science|social)-[a-z0-9-]+$"
    },
    "subject": {
      "enum": [
        "chinese",
        "english",
        "math",
        "science",
        "social"
      ]
    },
    "type": {
      "enum": [
        "single-choice",
        "multiple-choice",
        "constructed-response"
      ]
    },
    "prompt": {
      "type": "string",
      "minLength": 1
    },
    "options": {
      "type": "array",
      "items": {
        "type": "object",
        "additionalProperties": false,
        "required": [
          "id",
          "text"
        ],
        "properties": {
          "id": {
            "type": "string",
            "pattern": "^[A-Z]$"
          },
          "text": {
            "type": "string",
            "minLength": 1
          }
        }
      },
      "minItems": 2,
      "uniqueItems": true
    },
    "knowledgeIds": {
      "type": "array",
      "items": {
        "type": "string",
        "pattern": "^kg-"
      },
      "minItems": 1,
      "uniqueItems": true
    },
    "examPatternRefs": {
      "type": "array",
      "minItems": 1,
      "items": {
        "type": "object",
        "additionalProperties": false,
        "required": [
          "url",
          "title",
          "year",
          "subject",
          "locator",
          "locatorLevel",
          "observedPattern",
          "reuseDecision",
          "status"
        ],
        "properties": {
          "url": { "type": "string", "format": "uri" },
          "title": { "type": "string", "minLength": 1 },
          "year": { "type": "string", "minLength": 1 },
          "subject": { "type": "string", "minLength": 1 },
          "locator": { "type": "string", "minLength": 1 },
          "locatorLevel": { "enum": ["item", "paper", "page"] },
          "observedPattern": { "type": "string", "minLength": 1 },
          "pattern": {
            "type": "string",
            "minLength": 1,
            "description": "Legacy alias of observedPattern; if present, validate_data.py requires exact equality."
          },
          "reuseDecision": {
            "enum": ["pattern-only", "licensed-reproduction", "do-not-use"]
          },
          "status": {
            "enum": ["recorded", "pending-item-locator", "blocked"]
          }
        }
      }
    },
    "difficulty": {
      "enum": [
        "easy",
        "medium",
        "hard"
      ]
    },
    "answer": {
      "type": "object",
      "additionalProperties": false,
      "required": [
        "value",
        "explanation"
      ],
      "properties": {
        "value": {
          "type": "string",
          "minLength": 1
        },
        "explanation": {
          "type": "string",
          "minLength": 1
        }
      }
    },
    "solutionStrategy": {
      "type": "string",
      "minLength": 1
    },
    "solutionSteps": {
      "type": "array",
      "minItems": 3,
      "items": {
        "type": "string",
        "minLength": 1
      }
    },
    "provenance": {
      "type": "object",
      "additionalProperties": false,
      "required": [
        "origin",
        "license"
      ],
      "properties": {
        "origin": {
          "enum": [
            "original",
            "official-open",
            "licensed"
          ]
        },
        "license": {
          "type": "string",
          "minLength": 1
        },
        "sourceUrl": {
          "type": "string",
          "format": "uri"
        },
        "sourceLocator": {
          "type": "string"
        },
        "authoringNote": {
          "type": "string"
        }
      }
    },
    "reviewStatus": {
      "enum": [
        "draft",
        "content-reviewed",
        "published",
        "deprecated"
      ]
    },
    "updatedAt": {
      "type": "string",
      "format": "date"
    },
    "supersededBy": {
      "type": "string",
      "pattern": "^question-"
    },
    "lessonId": {
      "type": "string",
      "pattern": "^lesson-(chinese|english|math|science|social)-[a-z0-9-]+$"
    },
    "studyReferences": {
      "type": "array",
      "items": {
        "type": "string",
        "format": "uri"
      },
      "minItems": 1,
      "uniqueItems": true
    }
  },
  "allOf": [
    {
      "if": {
        "properties": {
          "type": {
            "const": "single-choice"
          }
        }
      },
      "then": {
        "required": [
          "options"
        ]
      }
    },
    {
      "if": {
        "properties": {
          "type": {
            "const": "multiple-choice"
          }
        }
      },
      "then": {
        "required": [
          "options"
        ]
      }
    }
  ]
}
