{
  "id": "question-math-content-a-8-4-10",
  "subject": "math",
  "type": "single-choice",
  "prompt": "下列哪一個是 9m²−16 的完整因式分解？",
  "options": [
    {
      "id": "A",
      "text": "(3m−4)(3m＋4)"
    },
    {
      "id": "B",
      "text": "(9m−4)(m＋4)"
    },
    {
      "id": "C",
      "text": "(3m−16)(3m＋1)"
    },
    {
      "id": "D",
      "text": "(9m−16)(m＋1)"
    }
  ],
  "knowledgeIds": [
    "kg-math-content-a-8-4"
  ],
  "difficulty": "medium",
  "answer": {
    "value": "A",
    "explanation": "9m²−16＝(3m)²−4²，使用平方差得 (3m−4)(3m＋4)，且兩因式不可再以整係數多項式分解。"
  },
  "provenance": {
    "origin": "original",
    "license": "All rights reserved",
    "sourceUrl": "https://www.grow22.com/download/114/114_cp/03_114P_Math.pdf",
    "sourceLocator": "三份公立學校公開數學試題僅供因式分解、乘法公式逆用與代數結構能力方向研究；未複製原題、選項、圖表或答案。",
    "authoringNote": "依官方課綱 KG 與三筆公立學校公開數學試題的因式分解能力方向獨立改寫；題幹、數值、選項、解析與五步解法均為原創，待第二輪 AI／Terra 內容複核。"
  },
  "reviewStatus": "draft",
  "updatedAt": "2026-09-10",
  "lessonId": "lesson-math-content-a-8-4",
  "examPatternRefs": [
    {
      "url": "https://school.tc.edu.tw/open-message/064510/get-file/5e49ebb9a2bac601505f73d8",
      "title": "臺中市立大甲國民中學二年級數學補考題庫（第三冊）",
      "year": "unknown",
      "subject": "math",
      "locator": "PDF 第 3 頁第 46 題：平方差因式分解",
      "observedPattern": "該公開原卷第 46 題提供「平方差因式分解」的能力模式參照；本題僅借鑑概念與判斷能力，題幹、數字、選項、答案及解法皆自行改寫。",
      "reuseDecision": "pattern-only",
      "status": "recorded",
      "locatorLevel": "item"
    },
    {
      "url": "https://school.tc.edu.tw/open-message/193506/get-file/6204ac4530ab0a5e342ecfe5.pdf",
      "title": "臺中市立北新國民中學數學科八年級補考試題",
      "year": "unknown",
      "subject": "math",
      "locator": "PDF 第 1 頁第 3 題：乘積形式與因式辨認",
      "observedPattern": "該公開原卷第 3 題提供「乘積形式與因式辨認」的能力模式參照；本題僅借鑑概念與判斷能力，題幹、數字、選項、答案及解法皆自行改寫。",
      "reuseDecision": "pattern-only",
      "status": "recorded",
      "locatorLevel": "item"
    },
    {
      "url": "https://school.tc.edu.tw/open-message/064519/get-file/698ae03c3cd80e32ef01bd8d",
      "title": "臺中市立大道國民中學 114 學年度第一學期八年級數學科補行評量題庫",
      "year": "114",
      "subject": "math",
      "locator": "PDF 第 1 頁第 2 題：平方差式的因式判斷",
      "observedPattern": "該公開原卷第 2 題提供「平方差式的因式判斷」的能力模式參照；本題僅借鑑概念與判斷能力，題幹、數字、選項、答案及解法皆自行改寫。",
      "reuseDecision": "pattern-only",
      "status": "recorded",
      "locatorLevel": "item"
    }
  ],
  "solutionStrategy": "先把兩項辨成平方，再寫出一正一負的兩個因式。",
  "solutionSteps": [
    "確認 9m²＝(3m)²、16＝4²。",
    "套用平方差公式。",
    "寫成 (3m−4)(3m＋4)。",
    "檢查乘積的中間項 −12m＋12m 抵消。",
    "選 A，完成完整因式分解。"
  ]
}
