{
  "id": "question-social-content-civ-bl-iv-5-7",
  "subject": "social",
  "type": "single-choice",
  "prompt": "兩個家庭每人分到相同數量的食物，但其中一戶有幼兒與病人。若討論結果公平，應補看什麼？",
  "options": [
    {
      "id": "A",
      "text": "需求差異、健康風險與實際可用程度；形式上相同不必然代表結果公平"
    },
    {
      "id": "B",
      "text": "只要每人數量相同，就已證明每戶需求獲得同樣滿足"
    },
    {
      "id": "C",
      "text": "病人與幼兒的需求不能納入公共分配，因為會破壞平等"
    },
    {
      "id": "D",
      "text": "結果公平只看物品數量，不必看使用效果"
    }
  ],
  "knowledgeIds": [
    "kg-social-content-civ-bl-iv-5"
  ],
  "difficulty": "medium",
  "answer": {
    "value": "A",
    "explanation": "公平可能比較需求與結果而非單純份量；要先說明採用哪一種公平標準。"
  },
  "provenance": {
    "origin": "original",
    "license": "All rights reserved",
    "sourceUrl": "https://www.jlsh.mlc.edu.tw/var/file/12/1012/img/113-2-7-4.pdf",
    "sourceLocator": "國立卓蘭高中附設國中部公開社會課程計畫；本題只研究公開試題與課程評量的能力結構。",
    "authoringNote": "依官方課綱、單元 KG、三個公立學校公開來源的題型方向，獨立改寫價格、抽籤、排隊、按需要、資格審查、混合制度、效率、公平、可近性與制度副作用；未複製原文、選項、圖表或答案；待第二輪 AI／Terra 內容複核。"
  },
  "reviewStatus": "draft",
  "updatedAt": "2026-09-09",
  "lessonId": "lesson-social-content-civ-bl-iv-5",
  "examPatternRefs": [
    {
      "url": "https://affairs.kh.edu.tw/1126/upload/file_list/149",
      "title": "高雄市立文府國中社會科公開試題與解答入口；僅研究公開題型與能力方向，未複製原題。",
      "year": "113-114",
      "subject": "social",
      "locator": "公共資源與制度比較",
      "observedPattern": "公立學校社會科公開試題以公共資源、制度比較、利害關係人與資料判讀考查分配推理；本題重新設計。",
      "reuseDecision": "pattern-only",
      "status": "recorded",
      "locatorLevel": "paper"
    },
    {
      "url": "https://www.dwm.kh.edu.tw/view/index.php?MainMenuId=64182&MainType=0&SubMenuId=64184&SubType=104&WebID=344",
      "title": "高雄市立大灣國中公開段考試題入口；僅研究公開題型與能力方向，未複製原題。",
      "year": "113-114",
      "subject": "social",
      "locator": "市場、配給與資料判讀",
      "observedPattern": "公立學校社會科公開試題以公共資源、制度比較、利害關係人與資料判讀考查分配推理；本題重新設計。",
      "reuseDecision": "pattern-only",
      "status": "recorded",
      "locatorLevel": "paper"
    }
  ],
  "solutionStrategy": "先界定稀少資源與需求差異，再把每種分配規則對照效率、公平、可近性、資訊、成本與誘因，最後提出有條件的制度比較。",
  "solutionSteps": [
    "讀題定位：圈出「結果公平」以及資源、需求者、分配規則、受益者與成本。",
    "建立比較表：分別記錄效率、公平、可近性、資訊、行政成本、誘因與副作用；本題核心是「公平可能比較需求與結果而非單純份量；要先說明採用哪一種公平標準。」",
    "核對正解：選項 A「需求差異、健康風險與實際可用程度；形式上相同不必然代表結果公平」同時處理規則效果與限制。",
    "排除誘答：找出把數量相同當公平、把速度當效率、把免費當零成本或把單一方法當成普遍最佳的說法。",
    "結論回查：確認答案有比較至少兩種制度，並標示資料、價值標準與受影響群體。"
  ],
  "studyReferences": [
    "https://www.jlsh.mlc.edu.tw/var/file/12/1012/img/113-2-7-4.pdf"
  ]
}
