{
  "id": "question-science-content-ba-iv-7-3",
  "subject": "science",
  "type": "single-choice",
  "prompt": "兩個質量相同的物體位於同一高度，取相同零位面，兩物體的重力位能如何？",
  "options": [
    {
      "id": "A",
      "text": "相同"
    },
    {
      "id": "B",
      "text": "質量相同所以都為零"
    },
    {
      "id": "C",
      "text": "較快者較大"
    },
    {
      "id": "D",
      "text": "無法比較，因為沒有給速度"
    }
  ],
  "knowledgeIds": [
    "kg-science-content-ba-iv-7"
  ],
  "difficulty": "easy",
  "answer": {
    "value": "A",
    "explanation": "重力位能 U＝mgh；質量 m、高度 h 與零位面都相同，因此兩者相同，速度不影響重力位能，選 A。"
  },
  "provenance": {
    "origin": "original",
    "license": "All rights reserved",
    "sourceUrl": "https://www.grow22.com/download/114/114_cp/05_114P_Nature.pdf",
    "sourceLocator": "三筆公立學校公開自然科試題／課程資料的動能、位能、力學能與摩擦能力方向；本題只作 pattern-only 改寫。",
    "authoringNote": "本題取公開資料能力方向，題幹、選項、答案、解析與五步解法均依 Ba-Ⅳ-7 重新撰寫，未複製原題、圖表或答案；待第二輪 AI／Terra 內容複核。"
  },
  "reviewStatus": "draft",
  "updatedAt": "2026-09-23",
  "lessonId": "lesson-science-content-ba-iv-7",
  "examPatternRefs": [
    {
      "url": "https://www.grow22.com/download/114/114_cp/05_114P_Nature.pdf",
      "title": "114 年國中教育會考自然科公開試題",
      "year": "114",
      "locator": "動能、位能、力學能、摩擦與能量資料判讀",
      "pattern": "取由高度、速度、質量與阻力資料推論能量互換的能力方向。",
      "subject": "science",
      "observedPattern": "取由高度、速度、質量與阻力資料推論能量互換的能力方向。",
      "reuseDecision": "pattern-only",
      "status": "recorded",
      "locatorLevel": "paper"
    }
  ],
  "solutionStrategy": "只把會出現在公式中的量列出，不把速度誤帶入重力位能。",
  "solutionSteps": [
    "寫出 U＝mgh。",
    "比較兩物體的 m，相同。",
    "比較高度 h，相同。",
    "零位面相同，g 也相同。",
    "所以重力位能相同，選 A。"
  ],
  "studyReferences": [
    "https://lgt.ntpc.edu.tw/TeachPlanFile_Upload/2022/plan/641_plan.pdf",
    "https://www.hkjh.hc.edu.tw/uploads/1661481260739sfuB4gG2.pdf"
  ]
}
