{
  "id": "question-science-content-ib-iv-3-6",
  "subject": "science",
  "type": "single-choice",
  "prompt": "為什麼近地面風不會完全沿等壓線平行吹？",
  "options": [
    {
      "id": "A",
      "text": "因為等壓線會自行移動"
    },
    {
      "id": "B",
      "text": "因為空氣沒有質量"
    },
    {
      "id": "C",
      "text": "地表摩擦使風速降低，壓力梯度與偏向作用的合成方向會改變"
    },
    {
      "id": "D",
      "text": "因為地表摩擦會使所有風垂直向上"
    }
  ],
  "knowledgeIds": [
    "kg-science-content-ib-iv-3"
  ],
  "difficulty": "medium",
  "answer": {
    "value": "C",
    "explanation": "近地面摩擦會減慢風，削弱偏向作用，使風跨越等壓線吹向低壓的一側，而不是理想化地完全平行。"
  },
  "provenance": {
    "origin": "original",
    "license": "All rights reserved",
    "sourceUrl": "https://www.grow22.com/download/114/114_cp/05_114P_Nature.pdf",
    "sourceLocator": "三筆公立學校／公開自然科試題與課程資料的地球自轉、偏向、氣壓旋轉及天氣圖判讀能力方向；本題只作 pattern-only 改寫來源。",
    "authoringNote": "本題取公開資料能力方向，題幹、選項、答案、解析與五步解法均依 Ib-Ⅳ-3 單元重新核對與撰寫，未複製原題、圖表或答案；待第二輪 AI／Terra 內容複核。"
  },
  "reviewStatus": "draft",
  "updatedAt": "2026-09-23",
  "lessonId": "lesson-science-content-ib-iv-3",
  "examPatternRefs": [
    {
      "url": "https://www.grow22.com/download/114/114_cp/05_114P_Nature.pdf",
      "title": "114 年國中教育會考自然科公開試題",
      "year": "114",
      "locator": "地球自轉、科氏力、氣壓系統與天氣圖",
      "pattern": "取由地球自轉、氣壓梯度、風向旋轉與等壓線資料判讀天氣系統的能力方向。",
      "subject": "science",
      "observedPattern": "取由地球自轉、氣壓梯度、風向旋轉與等壓線資料判讀天氣系統的能力方向。",
      "reuseDecision": "pattern-only",
      "status": "recorded",
      "locatorLevel": "paper"
    }
  ],
  "solutionStrategy": "先確認半球與壓力系統，再用壓力梯度、地轉偏向及摩擦判斷風場，最後回到天氣圖的多點與時間序列證據。",
  "solutionSteps": [
    "讀題定位：圈出「摩擦影響」以及半球、低壓／高壓、等壓線或時間序列。",
    "建立判準：近地面摩擦會減慢風，削弱偏向作用，使風跨越等壓線吹向低壓的一側，而不是理想化地完全平行。",
    "核對答案：選項 C「地表摩擦使風速降低，壓力梯度與偏向作用的合成方向會改變」符合地轉偏向與氣壓系統判讀。",
    "排除誘答：分清壓力梯度、偏向作用、摩擦與觀測證據，不能把單一箭頭當成完整風場。",
    "最後回查：確認方向是相對運動或中心的位置描述，且推論沒有超出資料。"
  ],
  "studyReferences": [
    "https://lgt.ntpc.edu.tw/TeachPlanFile_Upload/2022/plan/641_plan.pdf",
    "https://www.hkjh.hc.edu.tw/uploads/1661481260739sfuB4gG2.pdf"
  ]
}
