{
  "id": "question-science-content-jc-iv-4-7",
  "subject": "science",
  "type": "single-choice",
  "prompt": "細胞利用氧氣分解養分並釋放能量，從氧化還原角度可描述為？",
  "options": [
    {
      "id": "A",
      "text": "養分與氧氣都被還原"
    },
    {
      "id": "B",
      "text": "只有水發生氧化"
    },
    {
      "id": "C",
      "text": "完全沒有電子轉移"
    },
    {
      "id": "D",
      "text": "養分被氧化，氧氣作為電子接受者被還原"
    }
  ],
  "knowledgeIds": [
    "kg-science-content-jc-iv-4"
  ],
  "difficulty": "medium",
  "answer": {
    "value": "D",
    "explanation": "D。養分被氧化、氧氣被還原，電子轉移伴隨能量釋放；這是細胞呼吸的氧化還原描述，不等同直接燃燒。"
  },
  "provenance": {
    "origin": "original",
    "license": "All rights reserved",
    "sourceUrl": "https://www.nehs.tc.edu.tw/wp-content/uploads/sites/95/2026/02/6%E7%90%86%E5%8C%96%E7%A7%91-%E4%B9%9D%E5%B9%B4%E7%B4%9A-%E9%A1%8C%E5%BA%AB.pdf",
    "sourceLocator": "三筆公立學校公開自然／理化試題中的氧化還原、金屬置換、腐蝕防護、電池、資料判讀與安全能力；本題改寫為常見氧化還原反應原創情境。",
    "authoringNote": "依官方課綱 KG 與公立國中公開試題能力方向獨立改寫，未複製原文、選項、圖表或答案；待第二輪 AI／Terra 內容複核。"
  },
  "reviewStatus": "draft",
  "updatedAt": "2026-09-21",
  "lessonId": "lesson-science-content-jc-iv-4",
  "examPatternRefs": [
    {
      "url": "https://www.nehs.tc.edu.tw/wp-content/uploads/sites/95/2026/02/6%E7%90%86%E5%8C%96%E7%A7%91-%E4%B9%9D%E5%B9%B4%E7%B4%9A-%E9%A1%8C%E5%BA%AB.pdf",
      "title": "國立中科實驗高級中學公開九年級理化題庫；只取氧化還原、金屬反應與資料判讀的題型與推理方向，未複製原題、選項、圖表、答案或版面。",
      "year": "109-115",
      "subject": "science",
      "locator": "氧化還原、金屬反應與資料判讀",
      "observedPattern": "公立學校公開自然／理化試題常以金屬置換、氧化數、得失電子、腐蝕防護、漂白、呼吸作用、電池與安全資料考查氧化還原角色及控制變因；本題只取能力方向並重新設計情境與選項。",
      "reuseDecision": "pattern-only",
      "status": "recorded",
      "locatorLevel": "paper"
    },
    {
      "url": "https://www.nhjh.tp.edu.tw/uploads/1675417616549dOhkhC5L.pdf",
      "title": "臺北市立內湖國民中學公開九年級理化段考；只取氧化還原、腐蝕防護與生活應用的題型與推理方向，未複製原題、選項、圖表、答案或版面。",
      "year": "109-115",
      "subject": "science",
      "locator": "氧化還原、腐蝕防護與生活應用",
      "observedPattern": "公立學校公開自然／理化試題常以金屬置換、氧化數、得失電子、腐蝕防護、漂白、呼吸作用、電池與安全資料考查氧化還原角色及控制變因；本題只取能力方向並重新設計情境與選項。",
      "reuseDecision": "pattern-only",
      "status": "recorded",
      "locatorLevel": "paper"
    },
    {
      "url": "https://www.kcjh.kh.edu.tw/upload/190/104_34764/%E4%B8%89%E5%B9%B4%E7%B4%9A%E7%90%86%E5%8C%96-%E7%AC%AC三次段考5-OK.pdf",
      "title": "高雄市立國昌國民中學公開三年級自然科試題；只取金屬置換、電池與控制變因的題型與推理方向，未複製原題、選項、圖表、答案或版面。",
      "year": "109-115",
      "subject": "science",
      "locator": "金屬置換、電池與控制變因",
      "observedPattern": "公立學校公開自然／理化試題常以金屬置換、氧化數、得失電子、腐蝕防護、漂白、呼吸作用、電池與安全資料考查氧化還原角色及控制變因；本題只取能力方向並重新設計情境與選項。",
      "reuseDecision": "pattern-only",
      "status": "recorded",
      "locatorLevel": "paper"
    }
  ],
  "solutionStrategy": "分辨養分與氧氣在電子轉移中的角色，再連到能量釋放。",
  "solutionSteps": [
    "列出反應物、生成物與系統條件。",
    "追蹤氧元素或電子的來源、去向與氧化數變化。",
    "標出氧化者、還原者及相應的氧化劑／還原劑。",
    "用質量、顏色、電流、鏽蝕或安全資料等證據核對模型。",
    "寫出條件與限制，避免把單一現象擴張成沒有範圍的結論。"
  ]
}
