{
  "id": "question-science-content-na-iv-5-5",
  "subject": "science",
  "type": "single-choice",
  "prompt": "回收物中混入油污或不可回收複合材料，最可能造成什麼問題？",
  "options": [
    {
      "id": "A",
      "text": "使所有材料自動變成可回收"
    },
    {
      "id": "B",
      "text": "提高原料品質而不需處理"
    },
    {
      "id": "C",
      "text": "讓垃圾量必然變成零"
    },
    {
      "id": "D",
      "text": "降低回收物純度並增加分類與處理負荷"
    }
  ],
  "knowledgeIds": [
    "kg-science-content-na-iv-5"
  ],
  "difficulty": "hard",
  "answer": {
    "value": "D",
    "explanation": "A。油污和複合材料會降低回收物品質，造成整批污染、分選成本增加或改送焚化／掩埋；分類標誌不保證實際可回收。"
  },
  "provenance": {
    "origin": "original",
    "license": "All rights reserved",
    "sourceUrl": "https://www.yacjh.kh.edu.tw/upload/221/101_30637/114%E4%B8%8B%E5%AD%B8%E6%9C%9F%E7%AC%AC%E4%B8%80%E6%AC%A1%E6%AE%B5%E8%80%83%E4%B8%89%E5%B9%B4%E7%B4%9A%E8%87%AA%E7%84%B6.pdf",
    "sourceLocator": "三筆公立學校公開自然科試題中的廢棄物、污染路徑、減量、回收、處理方式、承載力與環境指標能力；本題改寫為廢棄物管理原創情境。",
    "authoringNote": "依官方課綱 KG 與公開會考／公立國中試題所呈現的能力方向獨立編寫；未複製原題文字、選項、圖表或答案；待第二輪 AI／Terra 內容複核。"
  },
  "reviewStatus": "draft",
  "updatedAt": "2026-09-21",
  "lessonId": "lesson-science-content-na-iv-5",
  "examPatternRefs": [
    {
      "url": "https://www.yacjh.kh.edu.tw/upload/221/101_30637/114%E4%B8%8B%E5%AD%B8%E6%9C%9F%E7%AC%AC%E4%B8%80%E6%AC%A1%E6%AE%B5%E8%80%83%E4%B8%89%E5%B9%B4%E7%B4%9A%E8%87%AA%E7%84%B6.pdf",
      "title": "高雄市立鹽埕國民中學公開自然科段考；只取廢棄物分類、污染路徑與環境影響的題型與推理方向，未複製原題、選項、圖表或答案。",
      "year": "113-114",
      "subject": "science",
      "locator": "廢棄物分類、污染路徑與環境影響",
      "observedPattern": "公開自然科評量常要求連結廢棄物來源、污染路徑、回收焚化掩埋、源頭減量、環境承載力與長期指標；本題以全新環境管理情境重寫。",
      "reuseDecision": "pattern-only",
      "status": "recorded",
      "locatorLevel": "paper"
    },
    {
      "url": "https://www.nhjh.tp.edu.tw/uploads/1738658165906utzaMLG4.pdf",
      "title": "臺北市立內湖國民中學公開自然科段考；只取回收、焚化、掩埋與環境承載力資料的題型與推理方向，未複製原題、選項、圖表或答案。",
      "year": "113-114",
      "subject": "science",
      "locator": "回收、焚化、掩埋與環境承載力資料",
      "observedPattern": "公開自然科評量常要求連結廢棄物來源、污染路徑、回收焚化掩埋、源頭減量、環境承載力與長期指標；本題以全新環境管理情境重寫。",
      "reuseDecision": "pattern-only",
      "status": "recorded",
      "locatorLevel": "paper"
    },
    {
      "url": "https://www.kcjh.kh.edu.tw/upload/190/104_34764/%E5%9C%8B%E6%98%8C--%E4%BA%8C%E5%B9%B4%E7%B4%9A--%E8%87%AA%E7%84%B6%E7%A7%91.pdf",
      "title": "高雄市立國昌國民中學公開自然科試題；只取減量、堆肥、資源循環與風險管理的題型與推理方向，未複製原題、選項、圖表或答案。",
      "year": "113-114",
      "subject": "science",
      "locator": "減量、堆肥、資源循環與風險管理",
      "observedPattern": "公開自然科評量常要求連結廢棄物來源、污染路徑、回收焚化掩埋、源頭減量、環境承載力與長期指標；本題以全新環境管理情境重寫。",
      "reuseDecision": "pattern-only",
      "status": "recorded",
      "locatorLevel": "paper"
    }
  ],
  "solutionStrategy": "先判斷材料是否乾淨、單一且可分選，再評估回收品質與後端去向。",
  "solutionSteps": [
    "圈出廢棄物來源、數量、材料、處理方式、環境受體與承載力指標。",
    "先判斷能否在源頭減量或重複使用，再比較回收、堆肥、焚化與掩埋的條件。",
    "追蹤物質是否轉移到空氣、水、土壤、底渣、飛灰或殘渣，而非只看垃圾離開視線。",
    "用量、品質、污染、能源、成本與時間趨勢資料比較方案，辨認副作用和替代解釋。",
    "回查結論適用的材料、處理設備、環境容量與管理條件，提出可長期監測的指標。"
  ]
}
