{
  "id": "question-chinese-content-ca-iv-1-6",
  "subject": "chinese",
  "type": "single-choice",
  "prompt": "登山步道旁的解說牌同時介紹地質、古道和當地祭典。若要設計一小時參訪，哪個安排最有脈絡？",
  "options": [
    {
      "id": "A",
      "text": "先隨機拍照，再補寫所有資料"
    },
    {
      "id": "B",
      "text": "只安排購物，不看解說牌"
    },
    {
      "id": "C",
      "text": "先看地質形成，再走古道觀察聚落，最後連到祭典如何使用這片環境"
    },
    {
      "id": "D",
      "text": "把三段資料完全分開，避免互相解釋"
    }
  ],
  "knowledgeIds": [
    "kg-chinese-content-ca-iv-1"
  ],
  "difficulty": "medium",
  "answer": {
    "value": "C",
    "explanation": "地質是環境背景，古道呈現人與地的利用，祭典再顯示文化延續；這個順序能讓參訪者理解關係。"
  },
  "provenance": {
    "origin": "original",
    "license": "All rights reserved",
    "sourceUrl": "https://www.sdjh.ntpc.edu.tw/var/file/0/1000/attach/16/pta_2229_1166226_19803.pdf",
    "sourceLocator": "公立學校公開國文段考與課程資料；只研究飲食、服飾、建築、交通、名勝與休閒文化的判讀方式。",
    "authoringNote": "依官方語文領域課綱、單元 KG 與三個公立學校公開來源，獨立改寫生活文化文本題；未複製原文、選項、篇章、圖片或答案；待第二輪 AI／Terra 內容複核。"
  },
  "reviewStatus": "draft",
  "updatedAt": "2026-09-13",
  "lessonId": "lesson-chinese-content-ca-iv-1",
  "examPatternRefs": [
    {
      "url": "https://www.sdjh.ntpc.edu.tw/var/file/0/1000/attach/16/pta_2229_1166226_19803.pdf",
      "title": "新北市立石碇國中公開國文試題；僅研究公開題型與能力方向，未複製原題。",
      "year": "113-114",
      "subject": "chinese",
      "locator": "文化生活與資料判讀",
      "observedPattern": "公立學校國文評量要求從飲食、服飾、建築、交通、名勝與休閒資料判讀生活方式及文化脈絡；本題使用全新情境。",
      "reuseDecision": "pattern-only",
      "status": "recorded",
      "locatorLevel": "paper"
    },
    {
      "url": "https://www.yacjh.kh.edu.tw/upload/221/101_30637/114%E4%B8%8B%E5%AD%B8%E6%9C%9F%E7%AC%AC%E4%B8%80%E6%AC%A1%E6%AE%B5%E8%80%83%E4%B8%89%E5%B9%B4%E7%B4%9A%E5%9C%8B%E6%96%87.pdf",
      "title": "高雄市立鹽埕國中公開國文段考；僅研究公開題型與能力方向，未複製原題。",
      "year": "113-114",
      "subject": "chinese",
      "locator": "生活文化、說明與推論",
      "observedPattern": "公立學校國文評量要求從飲食、服飾、建築、交通、名勝與休閒資料判讀生活方式及文化脈絡；本題使用全新情境。",
      "reuseDecision": "pattern-only",
      "status": "recorded",
      "locatorLevel": "paper"
    }
  ],
  "solutionStrategy": "按照環境條件、生活使用、文化意義建立參訪敘事。",
  "solutionSteps": [
    "先確認解說牌的三種資訊。",
    "用地質作為環境背景。",
    "在古道觀察人群與空間的使用。",
    "C 能把祭典放回地方脈絡。",
    "把順序打亂，說明理解會在哪一處中斷。"
  ],
  "studyReferences": [
    "https://www.jlsh.mlc.edu.tw/var/file/12/1012/img/113-2-7-4.pdf"
  ]
}
