{
  "id": "question-science-performance-ah-iv-2-6",
  "subject": "science",
  "type": "single-choice",
  "prompt": "若降溫設備只裝在一棟樓，決策報告至少應說明什麼？",
  "options": [
    {
      "id": "A",
      "text": "哪些人受益、哪些人承擔噪音或能源成本，以及如何改善不公平"
    },
    {
      "id": "B",
      "text": "只公布平均溫度"
    },
    {
      "id": "C",
      "text": "只說設備很新"
    },
    {
      "id": "D",
      "text": "把沒有設備的樓棟排除"
    }
  ],
  "knowledgeIds": [
    "kg-science-performance-ah-iv-2"
  ],
  "difficulty": "medium",
  "answer": {
    "value": "A",
    "explanation": "A 把分配影響和代價公開，公平不是一個平均數就能代表。 正確答案：A。"
  },
  "provenance": {
    "origin": "original",
    "license": "All rights reserved",
    "sourceUrl": "https://www.yacjh.kh.edu.tw/upload/221/101_30637/114%E4%B8%8B%E5%AD%B8%E6%9C%9F%E7%AC%AC%E4%B8%80%E6%AC%A1%E6%AE%B5%E8%80%83%E4%B8%89%E5%B9%B4%E7%B4%9A%E8%87%AA%E7%84%B6.pdf",
    "sourceLocator": "三個公立國中公開自然科評量；僅研究科學應用、方案比較、風險與責任決策能力方向，不重製原題、選項、圖表或答案。",
    "authoringNote": "依官方課綱 KG 與三個公立學校公開自然科評量來源能力方向獨立重寫；情境、選項、答案、解析與五步解題均為原創；待第二輪 AI/Terra 內容複核。"
  },
  "reviewStatus": "draft",
  "updatedAt": "2026-09-21",
  "lessonId": "lesson-science-performance-ah-iv-2",
  "examPatternRefs": [
    {
      "url": "https://www.yacjh.kh.edu.tw/upload/221/101_30637/114%E4%B8%8B%E5%AD%B8%E6%9C%9F%E7%AC%AC%E4%B8%80%E6%AC%A1%E6%AE%B5%E8%80%83%E4%B8%89%E5%B9%B4%E7%B4%9A%E8%87%AA%E7%84%B6.pdf",
      "title": "高雄市立鹽埕國民中學公開自然科段考；僅取能力方向，未複製原題、選項、圖表或答案。",
      "year": "113-114",
      "subject": "science",
      "locator": "科學應用、資料與決策能力方向",
      "observedPattern": "公開自然科評量常以資料、方案、環境、風險與證據界線要求應用科學做決定；本題為獨立改寫。",
      "reuseDecision": "pattern-only",
      "status": "recorded",
      "locatorLevel": "paper"
    },
    {
      "url": "https://www.hcjh.ntpc.edu.tw/p/406-1000-7527%2Cr146.php",
      "title": "新北市立新埔國民中學公開段考試題頁；僅取能力方向，未複製原題、選項、圖表或答案。",
      "year": "113-114",
      "subject": "science",
      "locator": "環境議題、證據與責任決策能力方向",
      "observedPattern": "公開自然科評量常以資料、方案、環境、風險與證據界線要求應用科學做決定；本題為獨立改寫。",
      "reuseDecision": "pattern-only",
      "status": "recorded",
      "locatorLevel": "paper"
    }
  ],
  "solutionStrategy": "先界定目標和限制，再比較證據、指標、風險、可逆性、公平與受影響者，最後設計試行和監測。",
  "solutionSteps": [
    "讀題定位：圈出決策核心「fairness」。",
    "列出目標、限制、證據指標、受影響者、風險、不確定性與可逆性。",
    "逐項比對方案是否有可檢查的理由；正確答案是 A。",
    "核對理由：A 把分配影響和代價公開，公平不是一個平均數就能代表。",
    "最後回查哪些部分可由數據支持、哪些需要公平與責任討論，並寫出監測或修正行動。"
  ]
}
