{
  "id": "question-social-content-civ-bi-iv-1-6",
  "subject": "social",
  "type": "single-choice",
  "prompt": "警方偵查時以威脅方式逼迫嫌疑人承認犯罪，且不讓其接觸律師。主要侵害？",
  "options": [
    {
      "id": "A",
      "text": "正當法律程序、緘默與辯護等權利，取得證據的方式也可能影響其證據能力"
    },
    {
      "id": "B",
      "text": "只要警方最後找到真相，偵查手段就不需要受程序限制"
    },
    {
      "id": "C",
      "text": "嫌疑人若被懷疑犯罪，就自動放棄律師與不自證己罪的權利"
    },
    {
      "id": "D",
      "text": "程序保障只保護無辜者，與所有刑事案件都無關"
    }
  ],
  "knowledgeIds": [
    "kg-social-content-civ-bi-iv-1"
  ],
  "difficulty": "medium",
  "answer": {
    "value": "A",
    "explanation": "刑事程序保障避免國家以威脅或不正方式取得自白，並維護公平審判。"
  },
  "provenance": {
    "origin": "original",
    "license": "All rights reserved",
    "sourceUrl": "https://www.jlsh.mlc.edu.tw/var/file/12/1012/img/113-2-7-4.pdf",
    "sourceLocator": "國立卓蘭高中附設國中部公開社會課程計畫；本題只研究公開試題與課程評量的能力結構。",
    "authoringNote": "依官方課綱、單元 KG 與三個公立學校公開來源的題型方向，獨立改寫罪刑法定、法律明確性、責任原則、刑罰目的、刑法解釋、程序保障、少年責任、刑罰比例、刑法改革及多重資料；未複製原文、選項、圖表或答案；待第二輪 AI／Terra 內容複核。"
  },
  "reviewStatus": "draft",
  "updatedAt": "2026-09-09",
  "lessonId": "lesson-social-content-civ-bi-iv-1",
  "examPatternRefs": [
    {
      "url": "https://affairs.kh.edu.tw/1126/upload/file_list/149",
      "title": "高雄市立文府國中社會科公開試題與解答入口；僅研究公開題型與能力方向，未複製原題。",
      "year": "113-114",
      "subject": "social",
      "locator": "犯罪責任、刑罰與程序推理",
      "observedPattern": "公立學校社會科公開試題常以刑法、責任、程序、人權與多重資料考查公民推理；本題重新設計。",
      "reuseDecision": "pattern-only",
      "status": "recorded",
      "locatorLevel": "paper"
    },
    {
      "url": "https://www.dwm.kh.edu.tw/view/index.php?MainMenuId=64182&MainType=0&SubMenuId=64184&SubType=104&WebID=344",
      "title": "高雄市立大灣國中公開段考試題入口；僅研究公開題型與能力方向，未複製原題。",
      "year": "113-114",
      "subject": "social",
      "locator": "刑法、人權與多重資料",
      "observedPattern": "公立學校社會科公開試題常以刑法、責任、程序、人權與多重資料考查公民推理；本題重新設計。",
      "reuseDecision": "pattern-only",
      "status": "recorded",
      "locatorLevel": "paper"
    }
  ],
  "solutionStrategy": "先確認事前法律與犯罪要件，再檢查責任能力、程序證據、刑罰比例與救濟，最後區分起訴主張和法院證明。",
  "solutionSteps": [
    "讀題定位：圈出「程序保障」與犯罪構成、責任、刑罰、程序或證據線索。",
    "整理證據：分開法律明文、主觀責任、程序保障、損害、量刑與資料限制；本題核心是「刑事程序保障避免國家以威脅或不正方式取得自白，並維護公平審判。」。",
    "核對正解：選項 A「正當法律程序、緘默與辯護等權利，取得證據的方式也可能影響其證據能力」能回應題幹的刑法與罪刑法定判讀。",
    "排除誘答：檢查是否把結果、輿論、被害人情緒、警方懷疑或相似行為直接當成有罪與重刑理由。",
    "結論回查：確認答案同時顧及事前法律、明確性、責任、比例、公平程序與證據可靠性。"
  ],
  "studyReferences": [
    "https://www.jlsh.mlc.edu.tw/var/file/12/1012/img/113-2-7-4.pdf"
  ]
}
