{
  "id": "question-english-performance-4-iv-4-2",
  "subject": "english",
  "type": "single-choice",
  "prompt": "A library request lists: Book—Cloud Atlas for Kids; Member ID—L204; Pickup day—Thursday; Copies—2. How many copies should the library prepare?",
  "options": [
    {
      "id": "A",
      "text": "Thursday"
    },
    {
      "id": "B",
      "text": "L204"
    },
    {
      "id": "C",
      "text": "2"
    },
    {
      "id": "D",
      "text": "Cloud Atlas for Kids"
    }
  ],
  "knowledgeIds": [
    "kg-english-performance-4-iv-4"
  ],
  "difficulty": "easy",
  "answer": {
    "value": "C",
    "explanation": "Copies records the requested quantity, which is 2. Thursday is the pickup day, L204 identifies the member, and Cloud Atlas for Kids is the title."
  },
  "provenance": {
    "origin": "original",
    "license": "All rights reserved",
    "sourceUrl": "https://www.csjh.kh.edu.tw/teach/exam/107%E4%B8%8B%E5%AD%B8%E6%9C%9F%E7%AC%AC%E4%B8%89%E6%AC%A1%E6%AE%B5%E8%80%83/%E8%8B%B1%E6%96%87/%E4%B8%80%E5%B9%B4%E7%B4%9A%E8%8B%B1%E6%96%87%E8%A9%A6%E9%A1%8C.pdf",
    "sourceLocator": "PDF第6頁第45至48題：閱讀雜誌訂閱表與訂戶欄位，判讀期數、價格、年齡、職業、電話及選項。",
    "authoringNote": "依官方課綱知識節點及公立國中公開英文表格／表單題的資料定位能力方向自行創作；未複製原卷內容。仍待完整內容與授權界線複核。"
  },
  "reviewStatus": "draft",
  "updatedAt": "2026-09-26",
  "lessonId": "lesson-english-performance-4-iv-4",
  "examPatternRefs": [
    {
      "url": "https://www.chhs.tp.edu.tw/uploads/1657612547412Wif0qWRZ.pdf",
      "title": "臺北市立景興國中110學年度第2學期七年級第2次定期評量英文科試題",
      "year": "110-2",
      "locator": "PDF第2頁第31至33題：閱讀兩份原創回饋表，按欄位擷取偏好、同行者與營業資訊。",
      "observedPattern": "題目先指定表單欄位，再要求從對應列／欄或附註找出資料；本題採全新人物、數值與表格。",
      "reuseDecision": "pattern-only",
      "status": "recorded",
      "subject": "english",
      "locatorLevel": "item"
    },
    {
      "url": "https://www.csjh.kh.edu.tw/teach/exam/107%E4%B8%8B%E5%AD%B8%E6%9C%9F%E7%AC%AC%E4%B8%89%E6%AC%A1%E6%AE%B5%E8%80%83/%E8%8B%B1%E6%96%87/%E4%B8%80%E5%B9%B4%E7%B4%9A%E8%8B%B1%E6%96%87%E8%A9%A6%E9%A1%8C.pdf",
      "title": "高雄市立中山國中107學年度第2學期第3次段考一年級英文科試題",
      "year": "107-2",
      "locator": "PDF第6頁第45至48題：閱讀雜誌訂閱表與訂戶欄位，判讀期數、價格、年齡、職業、電話及選項。",
      "observedPattern": "將勾選項目、欄位資料與表格旁的說明合併核對；本題改用不同表單用途與數值。",
      "reuseDecision": "pattern-only",
      "status": "recorded",
      "subject": "english",
      "locatorLevel": "item"
    },
    {
      "url": "https://www.chhs.tp.edu.tw/uploads/1612148562952u1jdsAwR.pdf",
      "title": "臺北市立景興國中109學年度第1學期八年級第2次定期評量英文科試題",
      "year": "109-1",
      "locator": "PDF第2頁第31至32題：依社團對話與報名表資訊判斷加入方式、截止日及活動安排。",
      "observedPattern": "表格閱讀需分清表內明列事實與對話指示，並依問題要求核對欄位或期限；本題採全新情境。",
      "reuseDecision": "pattern-only",
      "status": "recorded",
      "subject": "english",
      "locatorLevel": "item"
    }
  ],
  "solutionStrategy": "看到問數量時，找 Copies／Quantity 這類欄名；不要把日期或識別碼當成數量。",
  "solutionSteps": [
    "找出問題問的是 how many copies，也就是要找副本數量。",
    "在申請單中定位 Copies 欄，不要先看日期或會員代碼。",
    "沿著這個欄位讀出數值 2，並確認它對應這筆借閱申請。",
    "檢查 Thursday、L204 和書名各屬不同欄位，不能拿來回答數量。",
    "選 C；題目只問副本數，不要求加總或換算其他資料。"
  ]
}
