{
  "id": "question-science-content-cb-iv-3-6",
  "subject": "science",
  "type": "single-choice",
  "prompt": "以 C₂H₆O 的兩種結構為例，哪一項比較能作為區分性證據？",
  "options": [
    {
      "id": "A",
      "text": "任意猜測其中一個名稱，不需量測或模型"
    },
    {
      "id": "B",
      "text": "只看樣品瓶的標籤字體"
    },
    {
      "id": "C",
      "text": "只把分子式再抄寫一次"
    },
    {
      "id": "D",
      "text": "一項可重現且與結構相關的性質差異，例如沸點或與水互溶程度的比較"
    }
  ],
  "knowledgeIds": [
    "kg-science-content-cb-iv-3"
  ],
  "difficulty": "medium",
  "answer": {
    "value": "D",
    "explanation": "區分兩種結構需要可重現、能與模型連結的觀察；單純標籤或重抄分子式沒有辨識力。選 D。"
  },
  "provenance": {
    "origin": "original",
    "license": "All rights reserved",
    "sourceUrl": "https://www.grow22.com/download/114/114_cp/05_114P_Nature.pdf",
    "sourceLocator": "三筆公立學校公開自然科試題／課程資料的分子式、結構式與同分異構物能力方向；本題只作 pattern-only 改寫。",
    "authoringNote": "本題取公開資料能力方向，題幹、選項、答案、解析與五步解法均依 Cb-Ⅳ-3 重新撰寫，未複製原題、圖表或答案；待第二輪 AI／Terra 內容複核。"
  },
  "reviewStatus": "draft",
  "updatedAt": "2026-09-23",
  "lessonId": "lesson-science-content-cb-iv-3",
  "examPatternRefs": [
    {
      "url": "https://www.grow22.com/download/114/114_cp/05_114P_Nature.pdf",
      "title": "114 年國中教育會考自然科公開試題",
      "year": "114",
      "locator": "分子式、結構式、同分異構物與物性資料判讀",
      "pattern": "取由分子式、原子連接方式與物性資料推論物質差異的能力方向。",
      "subject": "science",
      "observedPattern": "取由分子式、原子連接方式與物性資料推論物質差異的能力方向。",
      "reuseDecision": "pattern-only",
      "status": "recorded",
      "locatorLevel": "paper"
    }
  ],
  "solutionStrategy": "挑選能排除替代模型的證據，而不是只找看起來相關的資訊。",
  "solutionSteps": [
    "先列出兩個模型共同的分子式。",
    "找出兩個模型真正不同的結構部位。",
    "選擇可能受該部位影響且可重複測量的性質。",
    "確認測量結果能比較兩個模型而非只描述一個樣品。",
    "所以選 D。"
  ],
  "studyReferences": [
    "https://lgt.ntpc.edu.tw/TeachPlanFile_Upload/2022/plan/641_plan.pdf",
    "https://www.hkjh.hc.edu.tw/uploads/1661481260739sfuB4gG2.pdf"
  ]
}
