{
  "id": "question-social-content-geo-ba-iv-1-6",
  "subject": "social",
  "type": "single-choice",
  "prompt": "某乾燥內陸區以畜牧為主，灌溉河谷出現密集耕地。解釋這種景觀最需要？",
  "options": [
    {
      "id": "A",
      "text": "把降水、蒸發、水源位置、草場與灌溉技術放在同一個空間脈絡中"
    },
    {
      "id": "B",
      "text": "只說居民文化不同，不必查看自然資料"
    },
    {
      "id": "C",
      "text": "只用國家邊界解釋耕地集中"
    },
    {
      "id": "D",
      "text": "只看河谷面積，不比較水量季節性"
    }
  ],
  "knowledgeIds": [
    "kg-social-content-geo-ba-iv-1"
  ],
  "difficulty": "medium",
  "answer": {
    "value": "A",
    "explanation": "乾濕差異和可取得的水源會影響農牧選擇，技術與河谷位置又會改變人地互動。"
  },
  "provenance": {
    "origin": "original",
    "license": "All rights reserved",
    "sourceUrl": "https://www.yacjh.kh.edu.tw/upload/221/101_30637/114%E4%B8%8B%E5%AD%B8%E6%9C%9F%E7%AC%AC%E4%B8%80%E6%AC%A1%E6%AE%B5%E8%80%83%E4%B8%89%E5%B9%B4%E7%B4%9A%E7%9A%84%E7%A4%BE%E6%9C%83.pdf",
    "sourceLocator": "高雄市立鹽埕國中三年級社會科公開段考；本題只研究公開試題能力結構與資料型態。",
    "authoringNote": "依官方課綱、單元 KG 與三個公立學校公開來源的題型方向，獨立改寫中國自然地區差異情境；未複製原文、選項、圖表或答案；待第二輪 AI／Terra 內容複核。"
  },
  "reviewStatus": "draft",
  "updatedAt": "2026-09-09",
  "lessonId": "lesson-social-content-geo-ba-iv-1",
  "examPatternRefs": [
    {
      "url": "https://www.yacjh.kh.edu.tw/upload/221/101_30637/114%E4%B8%8B%E5%AD%B8%E6%9C%9F%E7%AC%AC%E4%B8%80%E6%AC%A1%E6%AE%B5%E8%80%83%E4%B8%89%E5%B9%B4%E7%B4%9A%E7%9A%84%E7%A4%BE%E6%9C%83.pdf",
      "title": "高雄市立鹽埕國中三年級社會科公開段考；僅研究公開題型與能力方向，未複製原題。",
      "year": "113-114",
      "subject": "social",
      "locator": "自然環境、區域與地圖資料判讀",
      "observedPattern": "公立學校社會科公開試題常見的自然環境、區域比較與資料推理能力，經本題重新設計。",
      "reuseDecision": "pattern-only",
      "status": "recorded",
      "locatorLevel": "paper"
    },
    {
      "url": "https://affairs.kh.edu.tw/1126/upload/file_list/149",
      "title": "高雄市立文府國中社會科公開試題與解答入口；僅研究公開題型與能力方向，未複製原題。",
      "year": "113-114",
      "subject": "social",
      "locator": "自然地理、人地互動與區域比較",
      "observedPattern": "公立學校社會科公開試題常見的自然環境、區域比較與資料推理能力，經本題重新設計。",
      "reuseDecision": "pattern-only",
      "status": "recorded",
      "locatorLevel": "paper"
    },
    {
      "url": "https://www.dwm.kh.edu.tw/view/index.php?MainMenuId=64182&MainType=0&SubMenuId=64184&SubType=104&WebID=344",
      "title": "高雄市立大灣國中公開段考試題入口；僅研究公開題型與能力方向，未複製原題。",
      "year": "113-114",
      "subject": "social",
      "locator": "地形、氣候、水系與生活推理",
      "observedPattern": "公立學校社會科公開試題常見的自然環境、區域比較與資料推理能力，經本題重新設計。",
      "reuseDecision": "pattern-only",
      "status": "recorded",
      "locatorLevel": "paper"
    }
  ],
  "solutionStrategy": "先建立自然區域的判準，再比較地勢、季風、水系與溫度等共同條件，最後加入人口、交通、技術與尺度檢查結論界線。",
  "solutionSteps": [
    "讀題定位：圈出「農牧分布」以及地形、氣候、水系、人口、交通或尺度條件。",
    "整理證據：把自然基礎和人為調適分開，再連成因果鏈；核心理由是「乾濕差異和可取得的水源會影響農牧選擇，技術與河谷位置又會改變人地互動。」。",
    "核對正解：選項 A「把降水、蒸發、水源位置、草場與灌溉技術放在同一個空間脈絡中」能同時回應題幹資料與自然地區差異的判讀要求。",
    "排除誘答：檢查是否把行政區、單一平均值、單一自然因素或單一案例直接當成全部解釋。",
    "結論回查：確認資料尺度、時間範圍與外推程度一致；若換地形或季節，重新檢查推論。"
  ]
}
