{
  "id": "question-social-performance-3b-5",
  "subject": "social",
  "type": "single-choice",
  "prompt": "在2024年7月23日地方文史館的資料中，小組探究「資料蒐整與應用」時，甲資料與乙資料出現差異。哪項做法最能支持可靠結論？",
  "options": [
    {
      "id": "A",
      "text": "把「資料蒐整與應用」的資料依來源、時間、範圍與可信度分層，先處理資料品質再提出結論。"
    },
    {
      "id": "B",
      "text": "只挑最符合預期的資料"
    },
    {
      "id": "C",
      "text": "把不同來源混成一筆數字"
    },
    {
      "id": "D",
      "text": "以資料量多寡取代來源檢查"
    }
  ],
  "knowledgeIds": [
    "kg-social-performance-3b"
  ],
  "difficulty": "hard",
  "answer": {
    "value": "A",
    "explanation": "證據品質會限制結論強度，不能先定結論再挑資料。 本題以「資料蒐整與應用」為單元脈絡重新設計。正確答案為選項 A：「把「資料蒐整與應用」的資料依來源、時間、範圍與可信度分層，先處理資料品質再提出結論。」。最後把這個選項放回題幹，確認它同時符合題目條件與本單元判準。"
  },
  "provenance": {
    "origin": "original",
    "license": "All rights reserved",
    "sourceUrl": "https://www.yacjh.kh.edu.tw/upload/221/101_30637/114%E4%B8%8B%E5%AD%B8%E6%9C%9F%E7%AC%AC%E4%B8%80%E6%AC%A1%E6%AE%B5%E8%80%83%E4%B8%89%E5%B9%B4%E7%B4%9A%E7%A4%BE%E6%9C%83.pdf",
    "sourceLocator": "高雄市立鹽埕國民中學 114 學年度第 2 學期第 1 次段考社會科；僅研究題型與能力方向，未複製原題文字、選項、圖片或答案。",
    "authoringNote": "依官方課綱 KG 與公開會考／公立國中試題所呈現的能力方向獨立編寫；未複製原題文字、選項、圖表或答案；待第二輪 AI／Terra 內容複核。"
  },
  "reviewStatus": "draft",
  "updatedAt": "2026-09-07",
  "lessonId": "lesson-social-performance-3b",
  "examPatternRefs": [
    {
      "url": "https://www.yacjh.kh.edu.tw/upload/221/101_30637/114%E4%B8%8B%E5%AD%B8%E6%9C%9F%E7%AC%AC%E4%B8%80%E6%AC%A1%E6%AE%B5%E8%80%83%E4%B8%89%E5%B9%B4%E7%B4%9A%E7%A4%BE%E6%9C%83.pdf",
      "title": "高雄市立鹽埕國民中學 114 學年度第 2 學期第 1 次段考社會科；僅研究題型與能力方向，未複製原題文字、選項、圖片或答案。",
      "year": "114",
      "subject": "social",
      "locator": "高雄市立鹽埕國民中學 114 學年度第 2 學期第 1 次段考社會科；僅研究題型與能力方向，未複製原題文字、選項、圖片或答案。",
      "observedPattern": "依官方課綱 KG 與公開會考／公立國中試題所呈現的能力方向獨立編寫；未複製原題文字、選項、圖表或答案；待第二輪 AI／Terra 內容複核。",
      "reuseDecision": "pattern-only",
      "status": "recorded",
      "locatorLevel": "paper"
    }
  ],
  "solutionStrategy": "先從題幹「在2024年7月23日地方文史館的資料中，小組探究「資料蒐整與應用」時，甲資料與乙資料出現差異。哪項做法最能支持可靠結論？」定位時間、空間、制度、資料尺度與利害關係，再依社會的時空、制度、資料與觀點建立判準；用「證據品質會限制結論強度，不能先定結論再挑資料。 本題以「資料蒐整與應用」為單元脈絡重新設計。」逐項檢核，最後區分資料事實、因果推論與仍有限制的解釋。",
  "solutionSteps": [
    "讀題定位：先找出題目要判斷的「資料蒐整與應用」條件、資料與限制。本題逐題核對：題幹「在2024年7月23日地方文史館的資料中，小組探究「資料蒐整與應用」時，甲資料與乙資料出現差異。哪項做法最能支持可靠結論？」；正解為選項 A「把「資料蒐整與應用」的資料依來源、時間、範圍與可信度分層，先處理資料品質再提出結論。」，須依本題條件判斷，不能直接套用其他題的排除結果。",
    "建立本題判準：先記下題幹「在2024年7月23日地方文史館的資料中，小組探究「資料蒐整與應用」時，甲資料與乙資料出現差異。哪項做法最能支持可靠結論？」的要求，再用答案解析指出的核心理由「證據品質會限制結論強度，不能先定結論再挑資料。 本題以「資料蒐整與應用」為單元脈絡重新設計。」作為逐項比對標準。",
    "核對正確選項 A：把「資料蒐整與應用」的資料依來源、時間、範圍與可信度分層，先處理資料品質再提出結論。 這個選項同時回應題幹條件與單元證據要求。",
    "逐項檢驗資料與觀點：對照題幹的時間、空間、制度、來源和尺度；正解 A「把「資料蒐整與應用」的資料依來源、時間、範圍與可信度分層，先處理資料品質再提出結論。」符合「證據品質會限制結論強度，不能先定結論再挑資料。 本題以「資料蒐整與應用」為單元脈絡重新設計。」，其餘選項有資料缺口、因果跳躍或程序不符。",
    "最後回查：把答案 A「把「資料蒐整與應用」的資料依來源、時間、範圍與可信度分層，先處理資料品質再提出結論。」放回完整題幹「在2024年7月23日地方文史館的資料中，小組探究「資料蒐整與應用」時，甲資料與乙資料出現差異。哪項做法最能支持可靠結論？」，確認它同時滿足題目要求與解析理由；若條件、數字、語境或資料尺度改變，必須重新建立判準，不可只沿用答案代號。"
  ]
}
