{
  "id": "question-science-content-db-iv-4-6",
  "subject": "science",
  "type": "single-choice",
  "prompt": "下列哪項最能說明激素在生殖系統中的作用方式？",
  "options": [
    {
      "id": "A",
      "text": "所有激素都只控制消化道，不會影響生殖功能"
    },
    {
      "id": "B",
      "text": "只在生殖器官表面流動，不會經由血液運送"
    },
    {
      "id": "C",
      "text": "激素就是精子或卵細胞本身，可直接與配子融合"
    },
    {
      "id": "D",
      "text": "由生殖腺等內分泌構造分泌後，隨血液到達標的器官，調節其活動"
    }
  ],
  "knowledgeIds": [
    "kg-science-content-db-iv-4"
  ],
  "difficulty": "medium",
  "answer": {
    "value": "D",
    "explanation": "激素由內分泌構造分泌，經體液或血液運送到具有受體的標的細胞，調節生殖週期、配子形成或其他生理活動。選 D。"
  },
  "provenance": {
    "origin": "original",
    "license": "All rights reserved",
    "sourceUrl": "https://www.grow22.com/download/114/114_cp/05_114P_Nature.pdf",
    "sourceLocator": "三筆公立學校公開自然科試題／課程資料的生殖系統、配子、受精、性生殖與激素調節能力方向；本題只作 pattern-only 改寫。",
    "authoringNote": "本題取公開資料能力方向，題幹、選項、答案、解析與五步解法均依 Db-Ⅳ-4 重新撰寫，未複製原題、圖表或答案；待第二輪 AI／Terra 內容複核。"
  },
  "reviewStatus": "draft",
  "updatedAt": "2026-09-23",
  "lessonId": "lesson-science-content-db-iv-4",
  "examPatternRefs": [
    {
      "url": "https://www.grow22.com/download/114/114_cp/05_114P_Nature.pdf",
      "title": "114 年國中教育會考自然科公開試題",
      "year": "114",
      "locator": "生殖、遺傳與生命延續相關資料判讀",
      "pattern": "取由生殖構造、遺傳資訊與資料推論生命延續的能力方向。",
      "subject": "science",
      "observedPattern": "取由生殖構造、遺傳資訊與資料推論生命延續的能力方向。",
      "reuseDecision": "pattern-only",
      "status": "recorded",
      "locatorLevel": "paper"
    }
  ],
  "solutionStrategy": "不要把激素當成細胞或器官；用『來源—運輸—標的—調節』四格判斷。",
  "solutionSteps": [
    "找出激素的來源是內分泌構造。",
    "確認激素可經血液運送。",
    "找出作用對象是具有相應受體的標的細胞。",
    "排除激素等同配子與只作用消化道的說法。",
    "所以選 D。"
  ],
  "studyReferences": [
    "https://lgt.ntpc.edu.tw/TeachPlanFile_Upload/2022/plan/641_plan.pdf",
    "https://www.hkjh.hc.edu.tw/uploads/1661481260739sfuB4gG2.pdf"
  ]
}
