{
  "id": "question-science-content-ina-iv-3-3",
  "subject": "science",
  "type": "single-choice",
  "prompt": "某新聞稱『新型電池充電次數增加兩倍，因此一定比現有電池更環保』，最先應追問哪項？",
  "options": [
    {
      "id": "A",
      "text": "完整生命週期是否包含原料開採、製造、運輸、回收與實際壽命"
    },
    {
      "id": "B",
      "text": "新聞標題的字體大小"
    },
    {
      "id": "C",
      "text": "電池外殼是否漂亮"
    },
    {
      "id": "D",
      "text": "使用者是否喜歡新名稱"
    }
  ],
  "knowledgeIds": [
    "kg-science-content-ina-iv-3"
  ],
  "difficulty": "hard",
  "answer": {
    "value": "A",
    "explanation": "充電次數只描述一項性能，環境影響還取決於材料、製程、能源來源、壽命與回收；必須比較完整生命週期。"
  },
  "provenance": {
    "origin": "original",
    "license": "All rights reserved",
    "sourceUrl": "https://www.yacjh.kh.edu.tw/upload/221/101_30637/114%E4%B8%8B%E5%AD%B8%E6%9C%9F%E7%AC%AC%E4%B8%80%E6%AC%A1%E6%AE%B5%E8%80%83%E4%B8%89%E5%B9%B4%E7%B4%9A%E8%87%AA%E7%84%B6.pdf",
    "sourceLocator": "三筆公立學校／公開自然科試題與課程資料的科學證據、新能源、環境影響及社會決策能力方向；本題只作 pattern-only 改寫來源。",
    "authoringNote": "依公開資料能力方向獨立改寫；題幹、選項、答案、解析與五步解法均依 INa-Ⅳ-3 單元重新撰寫，未複製原題、圖表或答案；待第二輪 AI／Terra 內容複核。"
  },
  "reviewStatus": "draft",
  "updatedAt": "2026-09-23",
  "lessonId": "lesson-science-content-ina-iv-3",
  "examPatternRefs": [
    {
      "url": "https://www.yacjh.kh.edu.tw/upload/221/101_30637/114%E4%B8%8B%E5%AD%B8%E6%9C%9F%E7%AC%AC%E4%B8%80%E6%AC%A1%E6%AE%B5%E8%80%83%E4%B8%89%E5%B9%B4%E7%B4%9A%E8%87%AA%E7%84%B6.pdf",
      "title": "高雄市立鹽埕國民中學 114 學年度第 2 學期第 1 次段考自然科公開試題",
      "year": "114",
      "locator": "能源轉換、環境影響與資料判讀",
      "pattern": "取由能源系統資料、控制變因與環境後果進行證據推理的能力方向。",
      "subject": "science",
      "observedPattern": "取由能源系統資料、控制變因與環境後果進行證據推理的能力方向。",
      "reuseDecision": "pattern-only",
      "status": "recorded",
      "locatorLevel": "paper"
    },
    {
      "url": "https://www.grow22.com/download/114/114_cp/05_114P_Nature.pdf",
      "title": "114 年國中教育會考自然科公開試題",
      "year": "114",
      "locator": "能源、環境、科學證據與生活決策",
      "pattern": "取從圖表、實驗與生活情境判斷科學主張及其限制的能力方向。",
      "subject": "science",
      "observedPattern": "取從圖表、實驗與生活情境判斷科學主張及其限制的能力方向。",
      "reuseDecision": "pattern-only",
      "status": "recorded",
      "locatorLevel": "paper"
    }
  ],
  "solutionStrategy": "區分單一性能指標與環境主張所需的系統邊界。",
  "solutionSteps": [
    "確認新聞主張的比較指標是充電次數。",
    "列出從原料到報廢的生命週期階段。",
    "檢查每階段的能源、排放和資源資料。",
    "B、C、D 不是環境影響證據。",
    "所以 A 是第一個必要追問。"
  ],
  "studyReferences": [
    "https://www.hkjh.hc.edu.tw/uploads/1661481260739sfuB4gG2.pdf"
  ]
}
