{
  "id": "question-math-content-s-9-11-7",
  "subject": "math",
  "type": "single-choice",
  "prompt": "若命題 P 可推出命題 Q，且已知 P 成立，依直接推理可得到什麼？",
  "options": [
    {
      "id": "A",
      "text": "Q 成立"
    },
    {
      "id": "B",
      "text": "P 一定不成立"
    },
    {
      "id": "C",
      "text": "Q 一定不成立"
    },
    {
      "id": "D",
      "text": "P 與 Q 毫無關係"
    }
  ],
  "knowledgeIds": [
    "kg-math-content-s-9-11"
  ],
  "difficulty": "easy",
  "answer": {
    "value": "A",
    "explanation": "由 P⇒Q 且 P 為真，套用條件推理可得 Q 為真，選 A。"
  },
  "provenance": {
    "origin": "original",
    "license": "All rights reserved",
    "sourceUrl": "https://www.grow22.com/download/114/114_cp/03_114P_Math.pdf",
    "sourceLocator": "三份公立學校公開數學試題僅供證明與推理能力方向研究；未複製原題、選項、圖表或答案。",
    "authoringNote": "依官方課綱 KG 與三筆公立學校公開數學試題的證明能力方向獨立改寫；題幹、數值、選項、解析與五步解法均為原創，待第二輪 AI／Terra 內容複核。"
  },
  "reviewStatus": "draft",
  "updatedAt": "2026-09-10",
  "lessonId": "lesson-math-content-s-9-11",
  "examPatternRefs": [
    {
      "url": "https://www.grow22.com/download/114/114_cp/03_114P_Math.pdf",
      "title": "114 年國中教育會考數學科公開試題",
      "year": "114",
      "subject": "math",
      "locator": "幾何證明的已知與求證、定理條件、直接推理、反例與量測證據界線",
      "observedPattern": "公立學校公開數學試題常要求辨認條件與結論、選用定理、建立推理鏈及判讀反例是否足以否定全稱敘述；本題只取能力方向。",
      "reuseDecision": "pattern-only",
      "status": "recorded",
      "locatorLevel": "paper"
    },
    {
      "url": "https://school.tc.edu.tw/open-message/193521/get-file/66b1c8536c734e12643924e2",
      "title": "臺中市立至善國民中學 112 學年度第二學期第一次定期評量七年級數學科",
      "year": "112",
      "subject": "math",
      "locator": "幾何證明的已知與求證、定理條件、直接推理、反例與量測證據界線",
      "observedPattern": "公立學校公開數學試題常要求辨認條件與結論、選用定理、建立推理鏈及判讀反例是否足以否定全稱敘述；本題只取能力方向。",
      "reuseDecision": "pattern-only",
      "status": "recorded",
      "locatorLevel": "paper"
    },
    {
      "url": "https://www.yacjh.kh.edu.tw/upload/221/101_30637/114%E4%B8%8B%E5%AD%B8%E6%9C%9F%E7%AC%AC%E4%B8%80%E6%AC%A1%E6%AE%B5%E8%80%83%E4%B8%89%E5%B9%B4%E7%B4%9A%E6%95%B8%E5%AD%B8.pdf",
      "title": "高雄市立鹽埕國民中學 114 學年度下學期第一次段考三年級數學科",
      "year": "114",
      "subject": "math",
      "locator": "幾何證明的已知與求證、定理條件、直接推理、反例與量測證據界線",
      "observedPattern": "公立學校公開數學試題常要求辨認條件與結論、選用定理、建立推理鏈及判讀反例是否足以否定全稱敘述；本題只取能力方向。",
      "reuseDecision": "pattern-only",
      "status": "recorded",
      "locatorLevel": "paper"
    }
  ],
  "solutionStrategy": "辨識蘊涵方向，不要把 P⇒Q 誤讀成 Q⇒P。",
  "solutionSteps": [
    "讀出已知推理規則 P⇒Q。",
    "確認前件 P 已成立。",
    "沿著箭頭方向使用規則。",
    "得到後件 Q 成立。",
    "選 A。"
  ]
}
