{
  "id": "question-science-content-ca-iv-1-3",
  "subject": "science",
  "type": "single-choice",
  "prompt": "想從食鹽水中取得食鹽晶體，最主要利用食鹽與水哪項性質差異？",
  "options": [
    {
      "id": "A",
      "text": "水可蒸發，食鹽在此條件下留下並結晶"
    },
    {
      "id": "B",
      "text": "食鹽會被濾紙截留而水不會"
    },
    {
      "id": "C",
      "text": "食鹽沸點比水低且先蒸出"
    },
    {
      "id": "D",
      "text": "食鹽會被磁鐵吸引"
    }
  ],
  "knowledgeIds": [
    "kg-science-content-ca-iv-1"
  ],
  "difficulty": "medium",
  "answer": {
    "value": "A",
    "explanation": "蒸發水分使溶液濃縮，食鹽析出形成晶體；這不是過濾或磁性分離，選 A。"
  },
  "provenance": {
    "origin": "original",
    "license": "All rights reserved",
    "sourceUrl": "https://www.grow22.com/download/114/114_cp/05_114P_Nature.pdf",
    "sourceLocator": "三筆公立學校公開自然科試題／課程資料的混合物分離、物性差異與流程設計能力方向；本題只作 pattern-only 改寫。",
    "authoringNote": "本題取公開資料能力方向，題幹、選項、答案、解析與五步解法均依 Ca-Ⅳ-1 重新撰寫，未複製原題、圖表或答案；待第二輪 AI／Terra 內容複核。"
  },
  "reviewStatus": "draft",
  "updatedAt": "2026-09-23",
  "lessonId": "lesson-science-content-ca-iv-1",
  "examPatternRefs": [
    {
      "url": "https://www.grow22.com/download/114/114_cp/05_114P_Nature.pdf",
      "title": "114 年國中教育會考自然科公開試題",
      "year": "114",
      "locator": "混合物分離、溶解度、沸點與色層分析判讀",
      "pattern": "取由成分物理性質差異設計分離流程並評估回收結果的能力方向。",
      "subject": "science",
      "observedPattern": "取由成分物理性質差異設計分離流程並評估回收結果的能力方向。",
      "reuseDecision": "pattern-only",
      "status": "recorded",
      "locatorLevel": "paper"
    }
  ],
  "solutionStrategy": "確認目標是留下溶質還是收集溶劑，再選擇蒸發結晶或蒸餾。",
  "solutionSteps": [
    "食鹽已溶於水，不能直接用過濾截留。",
    "加熱或靜置可讓水離開溶液。",
    "溶液濃度升高後食鹽析出。",
    "晶體可經過濾與乾燥取得。",
    "所以選 A。"
  ],
  "studyReferences": [
    "https://lgt.ntpc.edu.tw/TeachPlanFile_Upload/2022/plan/641_plan.pdf",
    "https://www.hkjh.hc.edu.tw/uploads/1661481260739sfuB4gG2.pdf"
  ]
}
