{
  "id": "question-social-domain-4",
  "subject": "social",
  "type": "single-choice",
  "prompt": "在2023年7月17日的社會議題資料中，社區有 100 萬元預算處理「社會國中學習重點」，居民意見不同。哪項決策方式較適當？",
  "options": [
    {
      "id": "A",
      "text": "用情緒強弱取代原則與證據"
    },
    {
      "id": "B",
      "text": "若「社會領域」涉及權利衝突，說明各方權利、限制條件與比例取捨，而非只宣布哪一方喜歡的答案。"
    },
    {
      "id": "C",
      "text": "以單一權利名稱壓過所有限制"
    },
    {
      "id": "D",
      "text": "把不同意見視為不必回應"
    }
  ],
  "knowledgeIds": [
    "kg-social-learning-focus"
  ],
  "difficulty": "medium",
  "answer": {
    "value": "B",
    "explanation": "權利衝突需要說明相互影響與限制理由，不能以單一口號取代分析。 本題以「社會領域」為單元脈絡重新設計。正確答案為選項 B：「若「社會領域」涉及權利衝突，說明各方權利、限制條件與比例取捨，而非只宣布哪一方喜歡的答案。」。最後把這個選項放回題幹，確認它同時符合題目條件與本單元判準。"
  },
  "provenance": {
    "origin": "original",
    "license": "All rights reserved",
    "sourceUrl": "https://www.yacjh.kh.edu.tw/upload/221/101_30637/114%E4%B8%8B%E5%AD%B8%E6%9C%9F%E7%AC%AC%E4%B8%80%E6%AC%A1%E6%AE%B5%E8%80%83%E4%B8%89%E5%B9%B4%E7%B4%9A%E7%A4%BE%E6%9C%83.pdf",
    "sourceLocator": "高雄市立鹽埕國民中學 114 學年度第 2 學期第 1 次段考社會科；僅研究題型與能力方向，未複製原題文字、選項、圖片或答案。",
    "authoringNote": "依官方課綱 KG 與公開會考／公立國中試題所呈現的能力方向獨立編寫；未複製原題文字、選項、圖表或答案；待第二輪 AI／Terra 內容複核。"
  },
  "reviewStatus": "draft",
  "updatedAt": "2026-09-07",
  "lessonId": "lesson-social-domain",
  "examPatternRefs": [
    {
      "url": "https://www.yacjh.kh.edu.tw/upload/221/101_30637/114%E4%B8%8B%E5%AD%B8%E6%9C%9F%E7%AC%AC%E4%B8%80%E6%AC%A1%E6%AE%B5%E8%80%83%E4%B8%89%E5%B9%B4%E7%B4%9A%E7%A4%BE%E6%9C%83.pdf",
      "title": "高雄市立鹽埕國民中學 114 學年度第 2 學期第 1 次段考社會科；僅研究題型與能力方向，未複製原題文字、選項、圖片或答案。",
      "year": "114",
      "subject": "social",
      "locator": "高雄市立鹽埕國民中學 114 學年度第 2 學期第 1 次段考社會科；僅研究題型與能力方向，未複製原題文字、選項、圖片或答案。",
      "observedPattern": "依官方課綱 KG 與公開會考／公立國中試題所呈現的能力方向獨立編寫；未複製原題文字、選項、圖表或答案；待第二輪 AI／Terra 內容複核。",
      "reuseDecision": "pattern-only",
      "status": "recorded",
      "locatorLevel": "paper"
    }
  ],
  "solutionStrategy": "先從題幹「在2023年7月17日的社會議題資料中，社區有 100 萬元預算處理「社會國中學習重點」，居民意見不同。哪項決策方式較適當？」定位時間、空間、制度、資料尺度與利害關係，再依社會的時空、制度、資料與觀點建立判準；用「權利衝突需要說明相互影響與限制理由，不能以單一口號取代分析。 本題以「社會領域」為單元脈絡重新設計。」逐項檢核，最後區分資料事實、因果推論與仍有限制的解釋。",
  "solutionSteps": [
    "讀題定位：先找出題目要判斷的「社會領域」條件、資料與限制。本題逐題核對：題幹「在2023年7月17日的社會議題資料中，社區有 100 萬元預算處理「社會國中學習重點」，居民意見不同。哪項決策方式較適當？」；正解為選項 B「若「社會領域」涉及權利衝突，說明各方權利、限制條件與比例取捨，而非只宣布哪一方喜歡的答案。」，須依本題條件判斷，不能直接套用其他題的排除結果。",
    "建立本題判準：先記下題幹「在2023年7月17日的社會議題資料中，社區有 100 萬元預算處理「社會國中學習重點」，居民意見不同。哪項決策方式較適當？」的要求，再用答案解析指出的核心理由「權利衝突需要說明相互影響與限制理由，不能以單一口號取代分析。 本題以「社會領域」為單元脈絡重新設計。」作為逐項比對標準。",
    "核對正確選項 B：若「社會領域」涉及權利衝突，說明各方權利、限制條件與比例取捨，而非只宣布哪一方喜歡的答案。 這個選項同時回應題幹條件與單元證據要求。",
    "逐項檢驗資料與觀點：對照題幹的時間、空間、制度、來源和尺度；正解 B「若「社會領域」涉及權利衝突，說明各方權利、限制條件與比例取捨，而非只宣布哪一方喜歡的答案。」符合「權利衝突需要說明相互影響與限制理由，不能以單一口號取代分析。 本題以「社會領域」為單元脈絡重新設計。」，其餘選項有資料缺口、因果跳躍或程序不符。",
    "最後回查：把答案 B「若「社會領域」涉及權利衝突，說明各方權利、限制條件與比例取捨，而非只宣布哪一方喜歡的答案。」放回完整題幹「在2023年7月17日的社會議題資料中，社區有 100 萬元預算處理「社會國中學習重點」，居民意見不同。哪項決策方式較適當？」，確認它同時滿足題目要求與解析理由；若條件、數字、語境或資料尺度改變，必須重新建立判準，不可只沿用答案代號。"
  ]
}
