{
  "id": "question-science-performance-pa-iv-1-7",
  "subject": "science",
  "type": "single-choice",
  "prompt": "在2023年12月6日校園實驗室的觀察中，針對「pa-Ⅳ-1：分析歸納、製作圖表與數學整理資料」提出可檢驗的科學問題，若比較 3 組、每組取樣 15 份資料，哪一項設計最適當？",
  "options": [
    {
      "id": "A",
      "text": "研究「pa-Ⅳ-1：分析歸納、製作圖表與數學整理資料」時只改變攪拌速度，其餘條件一致，設置3組、每組取樣15份並各重複測量4次"
    },
    {
      "id": "B",
      "text": "研究「pa-Ⅳ-1：分析歸納、製作圖表與數學整理資料」時同時改變攪拌速度與另一個條件，卻不記錄方法"
    },
    {
      "id": "C",
      "text": "研究「pa-Ⅳ-1：分析歸納、製作圖表與數學整理資料」時只測量3組中的一組就直接下結論"
    },
    {
      "id": "D",
      "text": "研究「pa-Ⅳ-1：分析歸納、製作圖表與數學整理資料」時先決定結論，再挑選支持結論的15筆資料"
    }
  ],
  "knowledgeIds": [
    "kg-science-performance-pa-iv-1"
  ],
  "difficulty": "medium",
  "answer": {
    "value": "A",
    "explanation": "可檢驗的問題需要明確變因、指標、控制條件與可重複的資料。 本題要回到題幹「在2023年12月6日校園實驗室的觀察中，針對「pa-Ⅳ-1：分析歸納、製作圖表與數學整理資料」提出可檢驗的科學問題，若比較 3 組、每組取樣 15 份資料，哪一項設計最適當？」核對；正確選項 A「研究「pa-Ⅳ-1：分析歸納、製作圖表與數學整理資料」時只改變攪拌速度，其餘條件一致，設置3組、每組取樣15份並各重複測量4次」符合這個判準。先把題幹的現象、變因與證據方向對齊，再檢查是否漏掉必要條件或過度延伸因果。"
  },
  "provenance": {
    "origin": "original",
    "license": "All rights reserved",
    "sourceUrl": "https://www.yacjh.kh.edu.tw/upload/221/101_30637/114%E4%B8%8B%E5%AD%B8%E6%9C%9F%E7%AC%AC%E4%B8%80%E6%AC%A1%E6%AE%B5%E8%80%83%E4%B8%89%E5%B9%B4%E7%B4%9A%E8%87%AA%E7%84%B6.pdf",
    "sourceLocator": "高雄市立鹽埕國民中學 114 學年度第 2 學期第 1 次段考自然科；僅研究題型與能力方向，未複製原題文字、選項、圖片或答案。",
    "authoringNote": "依官方課綱 KG 與公開會考／公立國中試題所呈現的能力方向獨立編寫；未複製原題文字、選項、圖表或答案；待第二輪 AI／Terra 內容複核。"
  },
  "reviewStatus": "draft",
  "updatedAt": "2026-09-07",
  "lessonId": "lesson-science-performance-pa-iv-1",
  "examPatternRefs": [
    {
      "url": "https://www.yacjh.kh.edu.tw/upload/221/101_30637/114%E4%B8%8B%E5%AD%B8%E6%9C%9F%E7%AC%AC%E4%B8%80%E6%AC%A1%E6%AE%B5%E8%80%83%E4%B8%89%E5%B9%B4%E7%B4%9A%E8%87%AA%E7%84%B6.pdf",
      "title": "高雄市立鹽埕國民中學 114 學年度第 2 學期第 1 次段考自然科；僅研究題型與能力方向，未複製原題文字、選項、圖片或答案。",
      "year": "114",
      "subject": "science",
      "locator": "高雄市立鹽埕國民中學 114 學年度第 2 學期第 1 次段考自然科；僅研究題型與能力方向，未複製原題文字、選項、圖片或答案。",
      "observedPattern": "依官方課綱 KG 與公開會考／公立國中試題所呈現的能力方向獨立編寫；未複製原題文字、選項、圖表或答案；待第二輪 AI／Terra 內容複核。",
      "reuseDecision": "pattern-only",
      "status": "recorded",
      "locatorLevel": "paper"
    }
  ],
  "solutionStrategy": "先辨識研究變因、觀察現象與可用證據，再用機制、守恆或模型關係逐項檢查選項；本題以「在2023年12月6日校園實驗室的觀察中，針對「pa-Ⅳ-1：分析歸納、製作圖表與數學整理資料」提出可檢驗的科學問題，若比較 3 組、每組取樣 15 份資料，哪一項設計最適當？」為判讀對象，先圈出條件，再用選項 A 的判準回查（對應 lesson-science-performance-pa-iv-1）。",
  "solutionSteps": [
    "讀題定位：先找出本題要判斷的核心條件與限制；題幹是「在2023年12月6日校園實驗室的觀察中，針對「pa-Ⅳ-1：分析歸納、製作圖表與數學整理資料」提出可檢驗的科學問題，若比較 3 組、每組取樣 15 份資料，哪一項設計最適當？」。",
    "建立本題判準：先記下題幹「在2023年12月6日校園實驗室的觀察中，針對「pa-Ⅳ-1：分析歸納、製作圖表與數學整理資料」提出可檢驗的科學問題，若比較 3 組、每組取樣 15 份資料，哪一項設計最適當？」的要求，再用答案解析指出的核心理由「可檢驗的問題需要明確變因、指標、控制條件與可重複的資料。」作為逐項比對標準。",
    "核對正確選項 A：研究「pa-Ⅳ-1：分析歸納、製作圖表與數學整理資料」時只改變攪拌速度，其餘條件一致，設置3組、每組取樣15份並各重複測量4次。依題目解析，可檢驗的問題需要明確變因、指標、控制條件與可重複的資料。",
    "逐項比對證據：檢查每個選項的現象、變因與因果方向是否能由題幹支持；正解 A「研究「pa-Ⅳ-1：分析歸納、製作圖表與數學整理資料」時只改變攪拌速度，其餘條件一致，設置3組、每組取樣15份並各重複測量4次」符合「可檢驗的問題需要明確變因、指標、控制條件與可重複的資料。」，錯誤選項多半省略必要條件或把推測當結論。",
    "最後回查：把答案 A「研究「pa-Ⅳ-1：分析歸納、製作圖表與數學整理資料」時只改變攪拌速度，其餘條件一致，設置3組、每組取樣15份並各重複測量4次」放回完整題幹「在2023年12月6日校園實驗室的觀察中，針對「pa-Ⅳ-1：分析歸納、製作圖表與數學整理資料」提出可檢驗的科學問題，若比較 3 組、每組取樣 15 份資料，哪一項設計最適當？」，確認它同時滿足題目要求與解析理由；若條件、數字、語境或資料尺度改變，必須重新建立判準，不可只沿用答案代號。"
  ]
}
